{
  "access_state": {
    "access_log_exists": false,
    "access_log_path": "results/local_artifacts/research_foundation/phase_3/phase_3_test_access_log_v0_1.jsonl",
    "model_execution_openings": 0
  },
  "checks": [
    {
      "check_id": "test_family_count_40",
      "status": "pass"
    },
    {
      "check_id": "test_family_ids_unique",
      "status": "pass"
    },
    {
      "check_id": "test_candidate_ids_frozen",
      "status": "pass"
    },
    {
      "check_id": "local_test_hash_frozen",
      "status": "pass"
    },
    {
      "check_id": "model_test_opening_zero",
      "status": "pass"
    },
    {
      "check_id": "phase_2_test_reuse_zero",
      "status": "pass"
    }
  ],
  "claim_boundary": "The held-out prompt/pair identities and local artifact are frozen. Human source mapping review preceded this freeze, but no Phase 3 condition output or model test execution has occurred.",
  "freeze_version": "phase_3_held_out_test_freeze_v0_1",
  "local_test_artifact": {
    "path": "results/local_artifacts/research_foundation/phase_3/phase_3_held_out_test_pairs_v0_1.jsonl",
    "row_count": 52,
    "sha256": "ca73552381c223564bdbbb8135379087288bc13009805fe896d34fca7fe7caba",
    "tracked": false
  },
  "split_manifest": {
    "path": "data/research_foundation/manifests/phase_3_family_split_v0_1.json",
    "sha256": "a76ba5500ff35247a1831ab06887b0bf7eee1b0cb0b7c309d479f3a61a05a417"
  },
  "status": "held_out_test_frozen_unopened_for_model_execution",
  "test_candidate_ids": [
    "p3fam_00e03fc00d193c5fab77",
    "p3fam_034e5d823c7d9198981a",
    "p3fam_044c936667547a0f3d62",
    "p3fam_0aea17b3347152a19405",
    "p3fam_0d595c4e0a6b48a94053",
    "p3fam_0deeb2c94b0da9133e72",
    "p3fam_0e25102df53b3e3f13ed",
    "p3fam_11bc0fd08e1bdbc52700",
    "p3fam_1378d054194378bea7ec",
    "p3fam_1543821f7dde7955a94e",
    "p3fam_183c0598adc55d046566",
    "p3fam_18c858ff9c798b324723",
    "p3fam_2028365a7b91a9ecc01f",
    "p3fam_2e8bd14d0b649065ced7",
    "p3fam_3041736d3f66c6c48388",
    "p3fam_341acf23b31b49e54461",
    "p3fam_342a65c3743aa9488f91",
    "p3fam_342d61f9df56fcf4be62",
    "p3fam_3642f795c358bdcc2c65",
    "p3fam_399b504c9dc740cc938c",
    "p3fam_4437a59757780a0ae878",
    "p3fam_448a57615ab911bd60ac",
    "p3fam_4864c31bfc36d9fa910c",
    "p3fam_4e8c21cbf2e5504f6204",
    "p3fam_5883badf35e15091ebef",
    "p3fam_5ce357481111b52f7127",
    "p3fam_71c16a74b23d13466c42",
    "p3fam_7676d6ea196b8db95e25",
    "p3fam_78b1c871f29095e15182",
    "p3fam_7ebdab2840451f56b4f2",
    "p3fam_86fcedeab7044237be3e",
    "p3fam_8915ce3fbd15c368544d",
    "p3fam_9c3643b6b9ac9afb8440",
    "p3fam_a070441e1c9dea3eac36",
    "p3fam_a091bb9e68e72819af39",
    "p3fam_a504d42a19103c8ff6d8",
    "p3fam_ab719810b875b5804b75",
    "p3fam_b6e36abffc2e0908c1ef",
    "p3fam_b994a633ec797cbcaf9a",
    "p3fam_ba5a8c57275da343c511",
    "p3fam_c95ca6c7601d357d901b",
    "p3fam_d7b5eca6a9017b0c259b",
    "p3fam_d7c18329587e61493e9d",
    "p3fam_d8695d4f265201d5d8a9",
    "p3fam_e03463b9c41ae52b2235",
    "p3fam_e5f117d2bebd249407af",
    "p3fam_e6282080dc5878f826b0",
    "p3fam_e9d5d83b74afcdc4ddaa",
    "p3fam_f2f87fc6b0e8ba1322d7",
    "p3fam_f3d1667642cee0cab83a",
    "p3fam_fdc81819cf38ce1e0655",
    "p3fam_fe971d924e91c45e8fc3"
  ],
  "test_candidate_ids_sha256": "e179c1143a205f536305479f06802250e43c2ab363b267bb4c9b722d8b0e77ad",
  "test_family_ids": [
    "p3iso_10ed46cce3b9909d079f",
    "p3iso_127cd134d5bed9ed750c",
    "p3iso_145d226c350f378f0681",
    "p3iso_14766037b0a8be1a07c8",
    "p3iso_14c14412c3c9cc85b2d0",
    "p3iso_150be6578bcba26956bc",
    "p3iso_1f46072e343c4a90bbfb",
    "p3iso_2cbb2c735a8d20ff4900",
    "p3iso_2eb760b78fc2246baf98",
    "p3iso_385932001fe49e9df3a8",
    "p3iso_44c570e2c98e208af5b0",
    "p3iso_4dbd3493c4e9551f35a8",
    "p3iso_4dc164e823a713c4bd5a",
    "p3iso_515994bb872d70eaae06",
    "p3iso_5738bc68e0b99044b928",
    "p3iso_5b703959e795fd179ca7",
    "p3iso_5d3fc3452d967bb7e939",
    "p3iso_63efdd6d688f5a8b8546",
    "p3iso_69140bfb228c6063fb6b",
    "p3iso_69f73d0ad81f649a07e3",
    "p3iso_6b4fdbf6ce85d15102e4",
    "p3iso_7dd29e8bc398512f7340",
    "p3iso_878f97b17edd794c9ff0",
    "p3iso_8bffe0020ed2a0fd8df8",
    "p3iso_8c22e66e3c8a0397a496",
    "p3iso_8d90889bd587102c90c3",
    "p3iso_8ee52329c3c754c31bac",
    "p3iso_90002c2be97b167217b7",
    "p3iso_954c500835bd67e7734d",
    "p3iso_993d858164eb9336e315",
    "p3iso_abd04468bad150fdbbc0",
    "p3iso_b4950d97ce212dad4d86",
    "p3iso_ba6c9a964998fdea7811",
    "p3iso_bb18481a9f76c35b1496",
    "p3iso_c783316e83899f4c573b",
    "p3iso_d9a2b32ba793966f671c",
    "p3iso_e6cb1bb3ccbe05727d22",
    "p3iso_eee5ef6179ff31084514",
    "p3iso_f8407699894d6766bbd4",
    "p3iso_fe4f99ba50ee580bf48d"
  ],
  "test_family_ids_sha256": "a8a61b008d01ddf0c819a5ecb408453a0a43e11fa0538aedad48c0940c31ee43"
}
